Deadline,AFADeadline,Organisation,Title,Location,App_link,App_email,Required_Docs,Other_Docs,Summary,App_JobID,source,Link,timestamp
11/30/2024,,KAIST College of Business,FACULTY POSITIONS IN FINANCE,"Seoul, Korea, Republic of (South Korea)", ,shjoo2006@kaist.ac.kr,"Curriculum Vitae, Job Market Paper/other papers, References (3)",University full-time faculty application form,"Applications invited for tenure-track/tenured Assistant, Associate or Full Professors in Finance at KAIST College of Business. Candidates must have a Ph.D. degree or be in the final stage of their dissertation.",J15713,SSRN,https://www.ssrn.com/index.cfm/en/janda/job/?id=15713,2024-10-23T21:39:07.644
11/29/2024,,Shanghai Advanced Institute of Finance at Shanghai Jiao Tong University,Assistant Professor in Finance,"Shanghai, China",http://apply.interfolio.com/154143,,"Cover Letter, Curriculum Vitae, Job Market Paper/other papers, References (3), Teaching Statement",,"Assistant Professor in Finance position at Shanghai Advanced Institute of Finance starting July 1, 2025. Candidates must have a PhD in Finance or a related field by the start of employment.",J15711,SSRN,https://www.ssrn.com/index.cfm/en/janda/job/?id=15711,2024-10-23T21:39:07.644
11/22/2024,,"Robert H Smith School of Business, University of Maryland",Assistant/Associate/Full Professor,"College Park, Maryland. United States",https://ejobs.umd.edu/postings/122372,,"Cover Letter, Curriculum Vitae, Job Market Paper/other papers, References (3)",,"Apply for faculty position at Robert H. Smith School of Business, University of Maryland. Submit cover letter, CV, 2-3 recent publications or working papers, and 3 reference contacts.",J15706,SSRN,https://www.ssrn.com/index.cfm/en/janda/job/?id=15706,2024-10-23T21:39:07.644
23-Sep-24,,Auburn University,Lecturer/Senior Lecturer/Professor of Practice in Real Estate,"Auburn, Alabama. United States",https://www.auemployment.com/postings/48490, ,"Cover Letter, Curriculum Vitae, References (3), Teaching Statement, Transcripts",Student Course Evaluations,Non-tenure track teaching position in Real Estate at Auburn University. Master's or Ph.D. required with 2+ years of teaching experience in finance or real estate.,J15705,SSRN,https://www.ssrn.com/index.cfm/en/janda/job/?id=15705,2024-10-23T21:39:07.644
,,Stevens School of Business,Associate/Full Professor of Finance,"Hoboken, New Jersey.",https://www.stevens.edu/business,jbalisi@stevens.edu,"Cover Letter, Curriculum Vitae, Research Statement, Teaching Statement","Publication representative of the applicant's research agenda, Teaching evaluations","The School of Business at Stevens Institute of Technology is accepting applications for a full-time, tenured or tenure track, faculty position in Finance at the Associate or Full Professor ranks. Candidates should have a Ph.D. in Finance, Economics, or related disciplines, and a strong record of research publications in top-tier journals.",ID: J15704,SSRN,https://www.ssrn.com/index.cfm/en/janda/job/?id=15704,2024-10-23T21:39:07.644
11/28/2024,,"Nanyang Technological University, Singapore",Open Rank Professor Positions in Finance,"Singapore, Singapore",https://ntu.wd3.myworkdayjobs.com/Careers/job/Gaia/Open-Rank-Professor-Positions-in-Finance_R00018385,nbs-fin-recruiting@ntu.edu.sg,"Cover Letter, Curriculum Vitae, References (3)",,"Multiple tenure-track Open Rank Professor Positions in Finance at Nanyang Business School, Nanyang Technological University, Singapore.",J15702,SSRN,https://www.ssrn.com/index.cfm/en/janda/job/?id=15702,2024-10-23T21:39:07.644
,,University of Wisconsin - Milwaukee,BUSINESS AFFAIRS DIRECTOR,"Milwaukee, Wisconsin.",https://apptrkr.com/5619317, ,"Cover Letter, References (3), Resume",,This application is for the Business Affairs Director position at the College of Letters and Science at UW-Milwaukee. The candidate must have a bachelor's degree and 3+ years of professional work experience performing directly related work within a similar function. ,J15700,SSRN,https://www.ssrn.com/index.cfm/en/janda/job/?id=15700,2024-10-23T21:39:07.644
9/27/2024,,Louisiana State University,Assistant Professor,"Baton Rouge, Louisiana.",https://lsu.wd1.myworkdayjobs.com/LSU/job/2900-BEC-North-Undergrad-Pavilion/Assistant-Professor_R00098596,finance@lsu.edu,"Cover Letter, Curriculum Vitae, Job Market Paper/other papers, References (3)","Research Statement, Teaching Statement, Transcript",Applications for an Assistant Professor position in the E.J. Ourso College of Business at Louisiana State University are being accepted. Candidates must have a PhD in Finance or related field and be actively involved in academic research.,J15699,SSRN,https://www.ssrn.com/index.cfm/en/janda/job/?id=15699,2024-10-23T21:39:07.644
12/6/2024,,"Baruch College, CUNY",Assistant Professor of Real Estate,"New York, New York. United States",https://cuny.jobs/new-york-ny/assistant-professor-real-estate/1C6FBB86D0D7475DA8D587A127B8B3C2/job/,,"Cover Letter, Curriculum Vitae, Statement of Commitment to Diversity",,"Assistant Professor of Real Estate position at Baruch College starting Fall 2025. Candidates must have a Ph.D. in Real Estate, Finance, Economics, or a related field and demonstrate high-quality scholarly research and outstanding teaching skills.",J15695,SSRN,https://www.ssrn.com/index.cfm/en/janda/job/?id=15695,2024-10-23T21:39:07.644
10/10/2024,,"Kelley School of Business, Indiana University-Bloomington","Assistant, Associate, Full Professor, Finance","Bloomington, Indiana.",https://indiana.peopleadmin.com/postings/25689,ksbfin@iu.edu,"Cover Letter, Curriculum Vitae, Job Market Paper/other papers, Teaching Statement",,"Finance Department job opening for tenured/tenure-track positions at the advanced assistant, associate, or full levels.",J15694,SSRN,https://www.ssrn.com/index.cfm/en/janda/job/?id=15694,2024-10-23T21:39:07.644
11/15/2024,,Bocconi University,Assistant Professor of Finance,"Milan, Italy",www.unibocconi.eu/jobmarket,faculty@unibocconi.it,"Curriculum Vitae, Job Market Paper/other papers, References (3)",Scientific curriculum (including a list of titles and publications),Bocconi University invites applications for a tenure-track position at the Assistant Professor level in the Department of Finance. The position is open to candidates working in all fields of Finance. The tenure track will run for up to eight years.,J15688,SSRN,https://www.ssrn.com/index.cfm/en/janda/job/?id=15688,2024-10-23T21:39:07.644
9/25/2024,,"Oregon State University, College of Business",Assistant Professor of Finance (Tenure-Track),"Corvallis, Oregon. United States",https://jobs.oregonstate.edu/postings/158376,,"Cover Letter, Curriculum Vitae, Research Statement, Teaching Statement",,"Oregon State University invites applications for a full-time tenure-track Assistant Professor in Finance position to begin September 16, 2025.",P08393UF,SSRN,https://www.ssrn.com/index.cfm/en/janda/job/?id=15683,2024-10-23T21:39:07.644
11/15/2024,,Yale School of Management,Assistant Professor of Finance,"New Haven, Connecticut. United States",http://apply.interfolio.com/152262,somfacultyrec@yale.edu,"Cover Letter, Curriculum Vitae, Job Market Paper/other papers, References (3)",Research Statement,Yale School of Management is seeking a tenure-track Assistant Professor in Finance.,J15679,SSRN,https://www.ssrn.com/index.cfm/en/janda/job/?id=15679,2024-10-23T21:39:07.644
11/10/2024,,Singapore Management University (Lee Kong Chian School of Business),"Full-Time Assistant, Associate, and Full Professors of Finance (Tenure Track)","Singapore, Singapore",https://smucareers.taleo.net/careersection/smu_ext_ft/jobdetail.ftl?job=24000071&tz=GMT+08:00&tzname=Asia/Singapore,financecv@smu.edu.sg,"Cover Letter, Curriculum Vitae, Job Market Paper/other papers, References (3), Research Statement, Teaching Evaluation(s), Teaching Statement",,"Singapore Management University invites applications for finance tenure-track and tenured positions at all levels in all areas of scholarship. Applications in digital, sustainable, entrepreneurial, and real estate finance are particularly encouraged.",J15673,SSRN,https://www.ssrn.com/index.cfm/en/janda/job/?id=15673,2024-10-23T21:39:07.644
yyyy-mm-dd,,Lingnan University,"Associate Professor / Assistant Professor, Department of Finance","Tuen Mun, Hong Kong",https://lingnan.csod.com/ux/ats/careersite/4/home/requisition/2485?c=lingnan,recruit@LN.edu.hk,"Cover Letter, Curriculum Vitae, References (3)",,Applications are invited for the post of Associate Professor / Assistant Professor in the Department of Finance at Lingnan University.,J15672,SSRN,https://www.ssrn.com/index.cfm/en/janda/job/?id=15672,2024-10-23T21:39:07.644
11/22/2024,,"National University of Singapore, NUS Business School, Department of Real Estate","Assistant Professors, Associate Professors, Professors in Real Estate Finance and Urban Economics","Singapore, Singapore",https://bschool.nus.edu.sg/real-estate/,nus.drerecruitment@gmail.com,"Cover Letter, Curriculum Vitae, Job Market Paper/other papers, References (3), Research Statement, Teaching Statement",NUS Personal Data Consent for Job Applicants,"The National University of Singapore invites applications for full-time, tenure-track positions in real estate finance and urban economics.",J15663,SSRN,https://www.ssrn.com/index.cfm/en/janda/job/?id=15663,2024-10-23T21:39:07.644
,,Cornerstone Research,Associate,"New York; Boston; Chicago; Washington, DC; London; Brussels; Los Angeles; San Francisco; Silicon Valley, California.",https://grad-chire.icims.com/jobs/3483/associate---phd/job,associate-recruiting@cornerstone.com,"Cover Letter, Curriculum Vitae, Job Market Paper/other papers, References (3)",,"Associate position at Cornerstone Research for PhD graduates with background in economics, finance, accounting, or marketing. Apply with cover letter, resume, and job market paper.",J15669,SSRN,https://www.ssrn.com/index.cfm/en/janda/job/?id=15669,2024-10-23T21:39:07.644
10/1/2024,,Rochester Institute of Technology,Tenure Track Faculty - Finance,"Rochester, New York.",http://careers.rit.edu/faculty,hzhang@saunders.rit.edu,"Cover Letter, Curriculum Vitae, List of References (3), Research Statement, Statement of Diversity Contribution, Statement of Teaching Philosophy",,"Apply for a tenure-track Finance faculty position at Saunders College of Business, RIT. Ph.D. in Finance or related field required.",9189BR,SSRN,https://www.ssrn.com/index.cfm/en/janda/job/?id=15667,2024-10-23T21:39:07.644
,,EDHEC Business School,Assistant/Associate/Full Professor in Finance,"Nice, France", ,Recrutementsprofs6@edhec.edu,"Cover Letter, Curriculum Vitae, List of Publications, References (2), Teaching Statement",,"EDHEC Business School is seeking faculty members for the position of Assistant/Associate/Full Professor in Finance, specializing in Quantitative Finance. Candidates must have completed a Ph.D. in Statistics, Data Science, Quantitative Economics, or Finance with specialization in Econometrics.",J15664,SSRN,https://www.ssrn.com/index.cfm/en/janda/job/?id=15664,2024-10-23T21:39:07.644
,,University of Oklahoma Price College of Business,Ranked Renewable Term (Non-Tenure Track) Assistant or Associate Professor of Finance,"Norman, Oklahoma. United States",https://apply.interfolio.com/152330,finance@ou.edu,"Cover Letter, Curriculum Vitae, Evidence of Teaching Effectiveness, References (3)",,Applications for a non-tenure track Assistant or Associate Professor of Finance position at University of Oklahoma are being accepted.,J15662,SSRN,https://www.ssrn.com/index.cfm/en/janda/job/?id=15662,2024-10-23T21:39:07.644
8/15/2025,,University of Oklahoma Price College of Business,Assistant or Associate Professor of Finance,"Norman, Oklahoma. United States",http://apply.interfolio.com/152473,,"Cover Letter, Curriculum Vitae, Job Market Paper/other papers (up to 3), Teaching Statement",,Assistant or Associate Professor of Finance position at University of Oklahoma. Candidates must have a Ph.D. in Finance or closely related discipline and strong research credentials.,J15661,SSRN,https://www.ssrn.com/index.cfm/en/janda/job/?id=15661,2024-10-23T21:39:07.644
11/24/2024,,Santa Clara University,Tenure-Track Faculty Positions in Finance,"Santa Clara, California. United States",https://wd1.myworkdaysite.com/recruiting/scu/scu/job/Santa-Clara-CA/Tenure-Track-Faculty-Positions-in-Finance_R4866,finance@scu.edu,"Cover Letter, Curriculum Vitae, Evidence of Graduate and/or Undergraduate Teaching Effectiveness, Job Market Paper/other papers, References (3), Statement of Research and Teaching Interests",,"Tenure-track Assistant Professor positions in Finance at the Leavey School of Business, Santa Clara University. Ph.D. in Finance, Economics, or related field required.",J15660,SSRN,https://www.ssrn.com/index.cfm/en/janda/job/?id=15660,2024-10-23T21:39:07.644
,,Florida Atlantic University,"Assistant Professor, Finance","Boca Raton, Florida.",https://fau.edu/jobs, ,"Cover Letter, Curriculum Vitae, Job Market Paper/other papers, Teaching Statement","Official Transcripts, Documentation of recent teaching evaluation scores",FAU's College of Business seeks to hire a tenure-track Assistant Professor of Finance for Fall 2025. Candidates must have an earned doctoral degree in Finance (or closely related discipline) from an AACSB accredited institution by the start date. Preference will be given to candidates with strong quantitative skills and expertise in current empirical-finance methods.,J15652,SSRN,https://www.ssrn.com/index.cfm/en/janda/job/?id=15652,2024-10-23T21:39:07.644
10/15/2024,,University of Nebraska-Lincoln,Assistant Professor in Finance,"Lincoln, Nebraska. United States",https://employment.unl.edu,finsearch@unl.edu,"Curriculum Vitae, Job Market Paper/other papers, References (3)",,"Tenure-track Assistant Professor position in finance at the University of Nebraska-Lincoln starting fall 2025. Candidates must have a Ph.D. in finance, a Ph.D. in Business with an emphasis in finance, or a Ph.D. in a related discipline.",F_240126,SSRN,https://www.ssrn.com/index.cfm/en/janda/job/?id=15650,2024-10-23T21:39:07.644
11/15/2024,,London School of Economics and Political Science,Assistant Professor in Finance,"London, United Kingdom",https://jobs.lse.ac.uk/Vacancies/W/1609/0/436663/15539/assistant-professor-in-finance,m.comben@lse.ac.uk,"Cover Letter, Curriculum Vitae, References (3), Research Statement, Teaching Statement",,"Applications are invited for an Assistant Professor in Finance post. Candidates should have a completed PhD in finance or economics and demonstrate a clear, well developed, and viable strategy for future outstanding research.",J15647,SSRN,https://www.ssrn.com/index.cfm/en/janda/job/?id=15647,2024-10-23T21:39:07.644
,,Boston College,Open Rank (Tenured or Tenure-Track) Faculty Position in Finance beginning fall 2025,"Chestnut Hill, Massachusetts. United States",apply.interfolio.com/151832, ,"Cover Letter, Curriculum Vitae, Job Market Paper/other papers, References (3)",Working papers or publications,Open Rank Faculty Position in Finance at Boston College beginning fall 2025. Candidates should have doctoral dissertation completed or near completion and show promise or evidence of significant scholarship and teaching ability.,J15637,SSRN,https://www.ssrn.com/index.cfm/en/janda/job/?id=15637,2024-10-23T21:39:07.644
,,"University of Virginia, Darden School of Business","Open Rank Professor of Finance, Tenured/Tenure-Track","Charlottesville, Virginia.",https://apply.interfolio.com/151057,FitzgeraldA@darden.virginia.edu,"Cover Letter, Curriculum Vitae, Job Market Paper/other papers, References (3)",,"Application for an Open Rank Professor of Finance position at the Darden School of Business, University of Virginia, starting Fall 2025.",J15633,SSRN,https://www.ssrn.com/index.cfm/en/janda/job/?id=15633,2024-10-23T21:39:07.644
9/13/2024,,University of Tennessee,Non-Tenure Track Position in Finance,"Knoxville, Tennessee.",http://apply.interfolio.com/153194,cruff@utk.edu,"Cover Letter, Curriculum Vitae, Job Market Paper/other papers, References (3)","Evidence of successful prior teaching use of technology (course materials, course design, teaching evaluations, etc.)",Application for a non-tenure track position in the Department of Finance at the University of Tennessee. The primary responsibilities will be teaching undergraduate finance classes and helping students outside of the classroom.,J15634,SSRN,https://www.ssrn.com/index.cfm/en/janda/job/?id=15634,2024-10-23T21:39:07.644
yyyy-mm-dd,,University of Georgia,Assistant or Associate Professor in Risk and Insurance,"Athens, Georgia. United States",https://www.ugajobsearch.com/postings/393798,dmccarth@uga.edu,"Cover Letter, Curriculum Vitae",,"UGA’s Risk Management program is seeking an Assistant or Associate Professor with excellent research potential or demonstrated output in risk and insurance, ability to teach undergraduate- and graduate-level courses, and commitment to the academic field of risk and insurance.",J15631,SSRN,https://www.ssrn.com/index.cfm/en/janda/job/?id=15631,2024-10-23T21:39:07.644
,,Columbia Business School,Associate/Full Professor - Finance,"New York, New York. United States",[http://apply.interfolio.com/152816](http://apply.interfolio.com/152816),[jab2192@gsb.columbia.edu](mailto:jab2192@gsb.columbia.edu),,,"The Graduate School of Business at Columbia University is seeking to hire one or more tenured faculty members in the area of finance. All applicants should have a Ph.D. from an accredited institution and a record of being an outstanding scholar in every respect, including research, teaching and service.",J15625,SSRN,https://www.ssrn.com/index.cfm/en/janda/job/?id=15625,2024-10-23T21:39:07.644
9/30/2024,,University of Arkansas,Assistant Professor in Finance,"Fayetteville, Texas.",https://uasys.wd5.myworkdayjobs.com/UASYS/job/Fayetteville/Assistant-Professor-of-Finance--Two-Open-Positions-_R0060959,,"Cover Letter, Curriculum Vitae, Evidence of teaching effectiveness, Job Market Paper/other papers, References (3)",,"Assistant Professor in Finance position at the University of Arkansas, starting August 11, 2025. Candidates are expected to publish research, teach finance courses, and contribute service to the university.",J15615,SSRN,https://www.ssrn.com/index.cfm/en/janda/job/?id=15615,2024-10-23T21:39:07.644
16-Aug-25,,"The University of Alabama, Culverhouse College of Business",Instructor of Real Estate,"Tuscaloosa, Alabama. United States",http://careers.ua.edu/cw/en-us/job/524631,slhudson3@ua.edu,"Cover Letter, Curriculum Vitae, References (3), Teaching Statement",Documentation of teaching effectiveness,Instructor of Real Estate position at The University of Alabama. Responsibilities include teaching and leadership in developing real estate programs. Non-tenure track position renewable every three years.,J15612,SSRN,https://www.ssrn.com/index.cfm/en/janda/job/?id=15612,2024-10-23T21:39:07.644
,,Texas Christian University,Assistant or Associate Professor of Finance,"Fort Worth, Texas. United States",https://jobs.tcu.edu/jobs/assistant-or-associate-professor-of-finance-tcu-main-campus-texas-united-states, ,"Cover Letter, Curriculum Vitae, References (3), Research Statement, Teaching Statement",,"Assistant or Associate Professor of Finance position at TCU requires a Ph.D. in Finance or related discipline, teaching effectiveness, and strong research capabilities.",J15607,SSRN,https://www.ssrn.com/index.cfm/en/janda/job/?id=15607,2024-10-23T21:39:07.644
8/16/2025,,"The University of Alabama, Culverhouse College of Business",Two Assistant Professor of Finance positions,"Tuscaloosa, Alabama. United States",https://careers.ua.edu/jobs/assistant-professor-of-finance-tenure-tenure-track-524579-tuscaloosa-alabama-united-states,slhudson3@ua.edu,"Cover Letter, Curriculum Vitae, Job Market Paper/other papers, References (3), Teaching Statement",,"Two Assistant Professor of Finance positions at the University of Alabama. Primary duties include teaching, research, and service. Candidates must have a doctoral degree in Finance or Economics.",J15598,SSRN,https://www.ssrn.com/index.cfm/en/janda/job/?id=15598,2024-10-23T21:39:07.644
,,Vanderbilt University,Seasoned Assistant/Tenured Associate Professors in Finance,"Nashville, Tennessee. United States",http://apply.interfolio.com/153019,nick.bollen@vanderbilt.edu,"Cover Letter, Curriculum Vitae, Job Market Paper/other papers, Representative Refereed Publications, Statement of Research and Teaching Interests, Teaching Statement",,The Owen Graduate School of Management at Vanderbilt University is seeking applications for two positions in the Finance group at the seasoned assistant/tenured associate level to begin August 2025.,J15596,SSRN,https://www.ssrn.com/index.cfm/en/janda/job/?id=15596,2024-10-23T21:39:07.644
11/22/2024,,Fordham University,TENURE-TRACK POSITION IN FINANCE,"New York, New York. United States",http://apply.interfolio.com/152450,jkondratowicz@fordham.edu,"Cover Letter, Curriculum Vitae, Job Market Paper/other papers, References (3), Teaching Statement",,"Tenure-track faculty position in Finance at Fordham University's Gabelli School of Business. Ph.D. or equivalent degree required in Finance, Economics, or a related field.",J15594,SSRN,https://www.ssrn.com/index.cfm/en/janda/job/?id=15594,2024-10-23T21:39:07.644
10/31/2024,,Stony Brook University,Associate/Full Professor of Finance,"Stony Brook, New York.",https://apptrkr.com/5527480,,"Cover Letter, Curriculum Vitae, Diversity and Inclusion Statement, Job Market Paper/other papers, References (3), Research Statement, Service Statement, Teaching Statement",,"The College of Business at Stony Brook University is seeking applicants for an Associate/Full professor position in Finance. This is a full-time appointment in the College's Finance area. The position starts on September 1, 2025.",J15595,SSRN,https://www.ssrn.com/index.cfm/en/janda/job/?id=15595,2024-10-23T21:39:07.644
,,Columbia Business School,Assistant/Associate Professor - Finance,"New York, New York. United States",http://apply.interfolio.com/152390,financesearch@gsb.columbia.edu,"Cover Letter, Curriculum Vitae, Research Statement, Teaching Statement",,"Columbia University's Graduate School of Business is hiring one or more tenure-track faculty members in finance, including entrepreneurship, corporate finance, asset pricing, household finance, and real estate.",J15578,SSRN,https://www.ssrn.com/index.cfm/en/janda/job/?id=15578,2024-10-23T21:39:07.644
10/15/2024,,University of North Carolina Wilmington,Assistant or Associate Professor of Finance,"Wilmington, North Carolina.",https://jobs.uncw.edu/postings/32858,,"Cover Letter, Curriculum Vitae, References (3)",,"Applications are invited for a tenure-track position in Finance at the University of North Carolina Wilmington. Candidates must have a PhD in Finance, Real Estate, or a related field.",,SSRN,https://www.ssrn.com/index.cfm/en/janda/job/?id=15579,2024-10-23T21:39:07.644
,,University of Technology Sydney,Lecturer/Senior Lecturer (equiv. to Assistant Professor),"Sydney, Australia",https://www.uts.edu.au/about/uts-business-school/finance-department,David.Michayluk@uts.edu.au,"Cover Letter, Curriculum Vitae, Job Market Paper/other papers, References (3), Teaching Statement",,Application for tenure-track Lecturer/Senior Lecturer position in the Finance Department at UTS Business School. Competitive teaching loads and research funding provided.,ID: J15576,SSRN,https://www.ssrn.com/index.cfm/en/janda/job/?id=15576,2024-10-23T21:39:07.644
3-Jan-25,,University of Wisconsin - Milwaukee,TEACHING PROFESSOR (Open Rank),"Milwaukee, Wisconsin.",https://apptrkr.com/5557835, ,"Cover Letter, Curriculum Vitae, References (3), Teaching Evaluations",,The Sheldon B. Lubar College of Business at the University of Wisconsin-Milwaukee invites applications for a Teaching Professor (Open Rank) who will also serve as the Dream Exchange Director of their finance programs.,J15575,SSRN,https://www.ssrn.com/index.cfm/en/janda/job/?id=15575,2024-10-23T21:39:07.644
9/1/2025,,University of Missouri - Columbia,Open Rank Tenure - Track ASSISTANT/ASSOCIATE PROFESSOR OF FINANCE,"Columbia, Missouri.",http://hrs.missouri.edu/find-a-job/academic/,muhrs@missouri.edu,"Cover Letter, Curriculum Vitae, References (3), Teaching Statement",Current Research Paper(s),"Application for tenure-track Assistant/Associate Professor of Finance position at University of Missouri with strong potential for high-quality research and publications in top-tier finance journals and potential for high-quality, impactful teaching at undergraduate, graduate, and doctoral levels.",52914,SSRN,https://www.ssrn.com/index.cfm/en/janda/job/?id=15572,2024-10-23T21:39:07.644
1-Aug-25,,Oklahoma State University,ASSISTANT/ASSOCIATE/FULL PROFESSOR IN FINANCE,"Stillwater, Oklahoma.",https://jobs.okstate.edu,finance@okstate.edu,"Cover Letter, Curriculum Vitae, Evidence of Teaching Effectiveness, Job Market Paper/other papers, References (3)",,Application for a tenure-track Faculty Position in Finance at Oklahoma State University. Rank and tenure will be based on experience and record of achievement. Demonstrated ability to conduct high-quality research and excellent teaching required.,req 18274,SSRN,https://www.ssrn.com/index.cfm/en/janda/job/?id=15570,2024-10-23T21:39:07.644
